{
  "captured_at": "2026-06-18T21:33:55.243862+00:00",
  "captured_by_phase": "PHASE_2_ARCHITECT",
  "source": "codebase_scan",
  "file_counts": {
    ".sql": 7,
    ".php": 99,
    ".css": 1,
    ".js": 3
  },
  "total_file_count": 110,
  "top_directories": [
    "api",
    "config",
    "pages",
    "partials",
    "public",
    "scripts",
    "tests"
  ],
  "domains": [
    "database",
    "api",
    "settlement",
    "notifications",
    "caching"
  ],
  "stack": {
    "language": "php",
    "framework": "vanilla-php",
    "database": "mysql",
    "package_manager": "composer"
  },
  "skill_justifications": {},
  "mcp_justifications": {},
  "last_drift_check": null,
  "accumulated_commit_weight": 0,
  "drift_check_count": 0,
  "last_analyzed_commit": "204bbbefd80bb5aa9261cd45b66d65565c0b59ec"
}